,headlines
9,"India News: Today's latest updates and breaking news from India, Live India News - NDTV.com | Page 10
NDTVहिन्दीBUSINESSMOVIESCRICKETTECHFOODCRYPTOWEB STORIESEDUCATIONAUTOSWASTHLIFESTYLEHEALTHSHOPPINGARTLIVE TV LATEST COVID-19 INDIA VIDEO OPINION WORLD CITIES OFFBEAT TRENDS Photos SOUTHPEOPLEScienceJobsWEATHERTV ScheduleTrainsSearchHomeIndia NewsIndia NewsLaser Lights Show At Kolkata's 'Burj Khalifa' Stopped. Here's Why
															Reported by Monideepa Banerjie, Edited by Saikat Kumar Bose  | Tuesday October 12, 2021, Kolkata                                                        
                                                        A laser light show at a Kolkata Durga Puja pandal modelled on Dubai's Burj Khalifa was stopped today after the pandal started drawing huge crowds.High Court Pulls Up Delhi Government In Cases Pending Against JuvenilesPress Trust of India   | Tuesday October 12, 2021, New Delhi                                                        
                                                        High Court pulled up the Delhi government for not taking steps to comply with its order for terminating, with immediate effect, all cases where inquiries are pending against minors in alleged petty offences before the Juvenile Justice Boards.Prevent Afghanistan From Becoming Source Of Terrorism: PM Modi At G20 SummitPress Trust of India   | Tuesday October 12, 2021, New Delhi                                                        
                                                        PM Narendra Modi on Tuesday called on the international community to ensure that Afghan territory does not become a source of radicalisation and terrorism, and pitched for a united global response to bring about the desired change in that country.PM Modi To Launch GatiShakti To Boost Infrastructure Development TodayPress Trust of India   | Tuesday October 12, 2021, New Delhi                                                        
                                                        Prime Minister Narendra Modi will launch PM GatiShakti-National Master Plan, which seeks to address the issue of a lack of coordination among various agencies by institutionalising holistic planning, today for multi-modal connectivity.Durga Puja: Roads Crowded As Bengal Soaks In Festive Spirit On 'Mahasaptami'Press Trust of India   | Tuesday October 12, 2021, Kolkata                                                        
                                                        West Bengal on Tuesday soaked in the festive spirit of Durga Puja on 'Mahasaptami', as devotees began the day with traditional rituals and revellers made a beeline for popular marquees across the state.""Understandable Concern"": India Flags Why Afghanistan Is A PriorityPress Trust of India   | Tuesday October 12, 2021, Nur-Sultan (Kazakhstan)                                                        
                                                        India said on Tuesday that the recent developments in Afghanistan have generated ""understandable concern"" in the region.Man Lost Bag With Rs 1 Lakh At Delhi Metro, Here's How He Got It Back
															Reported by Neeta Sharma, Edited by Akhil Kumar  | Tuesday October 12, 2021, New Delhi                                                        
                                                        A lost bag containing over Rs. 1 lakh and valuables were returned to its owner who forgot to pick it up from the x-ray machine at a metro station in Delhi.Terrorists Were Present In Area For 3 Months: J&K Police On Poonch AttackPress Trust of India   | Tuesday October 12, 2021, Jammu                                                        
                                                        Terrorists involved in the attack on security forces in Jammu's Poonch district that killed five army personnel were present in the area for two to three months, Jammu and Kashmir Police said on Tuesday.Maharashtra Leader Eknath Khadse's Wife Denied Bail In Pune Land Deal CaseAsian News International   | Tuesday October 12, 2021, New Delhi                                                        
                                                        A special court has rejected the anticipatory bail application of Mandakini Khadse, wife of Nationalist Congress Party leader Eknath Khadse, an accused in 2016 Pune land deal case.Evaluation Underway, Says Centre On Covid Vaccine For Children In IndiaAsian News International   | Tuesday October 12, 2021, New Delhi                                                        
                                                        Covid vaccine for children is currently being evaluated, Union Minister of State for Health and Family Welfare Bharati Pravin Pawar said Tuesday, adding, the vaccine will be launched after expert recommendation and approval from the drug regulator.Navjot Sidhu In Delhi On Thursday To Discuss ""Organisational Matters""
															Edited by Anindita Sanyal  | Tuesday October 12, 2021, New Delhi                                                        
                                                        Cricketer-turned politician Navjot Sidhu will meet Congress general secretary KC Venugopal and Harish Rawat in Delhi on Thursday. The meeting comes amid an uncomfortable truce between him and the new Punjab Chief Minister Charanjit Singh Channi.Delhi Urges Centre To Specify Covid Rules For Chhath As BJP Ups Pressure
															Edited by Saikat Kumar Bose  | Tuesday October 12, 2021, New Delhi                                                        
                                                        With the BJP stepping up its protests against the ban on Chhath Puja celebrations with an eye on the Purvanchali vote bank, the Delhi government has now written to the centre to issue guidelines to observe the festival amid the pandemic.Former Higher Education Secretary Amit Khare Appointed Adviser To PM ModiPress Trust of India   | Tuesday October 12, 2021, New Delhi                                                        
                                                        Former bureaucrat Amit Khare has been appointed as advisor to Prime Minister Narendra Modi for two years on contract basis.Gurmeet Ram Rahim's Sentencing In Murder Case Deferred Till MondayPress Trust of India   | Tuesday October 12, 2021, Chandigarh                                                        
                                                        A special CBI court in Panchkula today deferred till October 18 the pronouncement of quantum of punishment to Dera Sacha Sauda head Gurmeet Ram Rahim Singh and four others in a murder caseNo Load Shedding But ""Emergency"" To Continue, Says Maharashtra Minister
															Edited by Akhil Kumar  | Tuesday October 12, 2021, Mumbai                                                        
                                                        Maharashtra Energy minister Nitin Kashinath Raut said that there'd be no load shedding or shortage of power supply in the state, while also stressing that this ""emergency"" situation will continue for the next two months.15678910111213...14Trending Alert At Airports For Man Who Took Viral Selfie With Aryan Khan""Aryan Khan Wasn't Even On The Cruise, Nothing Found On Him,"" Court Told""Attack On Federalism"": Punjab Chief Minister Wants BSF Order Rolled BackHumorStaying 'Pawsitive' With Madhuri Dixit15 SlidesEntertainmentA Celebrity Guide To Durga Puja Fashion17 SlidesCelebAmitabh Bachchan's Stylish Eyewear10 SlidesAdvertisementAdvertisementAdvertisement................................ Advertisement ................................About UsAdvertiseNews AlertArchivesAppsCareersChannelsDisclaimerFeedbackInvestorsOmbudsmanRedressalsService TermsThis website follows the DNPA Code of Ethics © COPYRIGHT NDTV CONVERGENCE LIMITED 2021. ALL RIGHTS RESERVED.livetvarrowprintemailchatlinkedinredditWhatsAppfacebooktwittermorenotificationsearchsnapchatkooListen to the latest songs, only on JioSaavn.com
"
